"AVIATION","$6600","3-letter word for the side-to-side movement of the aircraft's nose, controlled in part by the rudder","yaw"
"OCCUPATIONAL NAMES","$6600","This common English last name indicates an ancestor who rounded wood on a lathe","Turner"
"CANADIAN PROVINCES","$6600","Place names in this province include Inverness & Caledonia","Nova Scotia"
"WHO WAS THE ENGLISH MONARCH WHEN...","$6600","...Napoleon lost at Waterloo","George III"
"PRESIDENTS & FIRST LADIES","$6600","His wife Frances left the White House, returned 4 years later, & may have said, "Look what they've done to the place!"","Grover Cleveland"
"DESCRIBING THE ARTWORK","$6600","We're not sure if you'd call that teal or azure the young man with a feathered cap is wearing in this 1770 work","Blue Boy"
"WALKING THE DOG","$6600","2 puppies rescued from a British brig off the coast of Maryland in 1807 are the ancestors of this retriever","Chesapeake Bay Retriever"
"CLASSICAL CLASSICS","$6600","Despite its name, this "Air" from Bach's Suite No. 3 was not inspired by the sight of a stripper's laundry drying on the line",""(Air On The) G String""
